{
    "schemaVersion": 1,
    "comment": "Human-maintained Parity Manifest classification rules (schema classification-rules-1.schema.json; semantics in ClassificationRules). Any entry in 'rules' beats any entry in 'defaults'; within a tier the most specific match wins (exact id > id glob with more literal characters > kind > deprecated); equally specific matches are an error. Defaults preserve only non-deprecated baseline entries and claim one dimension per kind; binary and behavioral claims need explicit rules backed by evidence. Deprecated entries have no default and must be classified explicitly.",
    "rules": [
        {
            "name": "dynamodb-get-item-v2-bytecode",
            "comment": "Binary and behavioral claims backed by V2 caller bytecode run against the generated V3 client and by the generated compatibility fixtures (codegen-generated-classes-test compatibility-scope.txt).",
            "match": {
                "id": "api:software.amazon.awssdk.services.dynamodb.DynamoDbClient#getItem(*"
            },
            "classification": "PRESERVED",
            "dimensions": [
                "source",
                "binary",
                "behavior"
            ],
            "rationale": "The generated V3 DynamoDbClient keeps the V2 getItem overloads with identical JVM descriptors; compiled V2 callers link and receive the same modeled results.",
            "evidenceIds": [
                "DynamoDbGeneratedApiTest",
                "V2BytecodeOnV3Test"
            ]
        },
        {
            "name": "dynamodb-get-item-request-builder-v2-bytecode",
            "comment": "Exercised by the V2 caller of V2BytecodeOnV3Test and its generated linkage fixture.",
            "match": {
                "id": "api:software.amazon.awssdk.services.dynamodb.model.GetItemRequest#builder()*"
            },
            "classification": "PRESERVED",
            "dimensions": [
                "source",
                "binary"
            ],
            "rationale": "The generated V3 GetItemRequest keeps the static builder() factory and its V2 JVM descriptor.",
            "evidenceIds": [
                "V2BytecodeOnV3Test"
            ]
        },
        {
            "name": "dynamodb-get-item-request-table-name-v2-bytecode",
            "comment": "Exercised by the V2 caller of V2BytecodeOnV3Test and its generated linkage fixture.",
            "match": {
                "id": "api:software.amazon.awssdk.services.dynamodb.model.GetItemRequest$Builder#tableName(*"
            },
            "classification": "PRESERVED",
            "dimensions": [
                "source",
                "binary"
            ],
            "rationale": "The generated V3 GetItemRequest.Builder keeps the fluent member setter and its V2 JVM descriptor.",
            "evidenceIds": [
                "V2BytecodeOnV3Test"
            ]
        },
        {
            "name": "dynamodb-get-item-request-key-v2-bytecode",
            "comment": "Exercised by the V2 caller of V2BytecodeOnV3Test and its generated linkage fixture.",
            "match": {
                "id": "api:software.amazon.awssdk.services.dynamodb.model.GetItemRequest$Builder#key(Ljava/util/Map;)*"
            },
            "classification": "PRESERVED",
            "dimensions": [
                "source",
                "binary"
            ],
            "rationale": "The generated V3 GetItemRequest.Builder keeps the fluent map member setter and its V2 JVM descriptor.",
            "evidenceIds": [
                "V2BytecodeOnV3Test"
            ]
        },
        {
            "name": "dynamodb-get-item-request-consistent-read-v2-bytecode",
            "comment": "Exercised by the V2 caller of V2BytecodeOnV3Test and its generated linkage fixture.",
            "match": {
                "id": "api:software.amazon.awssdk.services.dynamodb.model.GetItemRequest$Builder#consistentRead(*"
            },
            "classification": "PRESERVED",
            "dimensions": [
                "source",
                "binary"
            ],
            "rationale": "The generated V3 GetItemRequest.Builder keeps the boxed Boolean member setter and its V2 JVM descriptor.",
            "evidenceIds": [
                "V2BytecodeOnV3Test"
            ]
        },
        {
            "name": "dynamodb-get-item-response-item-v2-bytecode",
            "comment": "Exercised by the V2 caller of V2BytecodeOnV3Test and its generated linkage fixture.",
            "match": {
                "id": "api:software.amazon.awssdk.services.dynamodb.model.GetItemResponse#item()*"
            },
            "classification": "PRESERVED",
            "dimensions": [
                "source",
                "binary"
            ],
            "rationale": "The generated V3 GetItemResponse keeps the map member accessor and its V2 JVM descriptor.",
            "evidenceIds": [
                "V2BytecodeOnV3Test"
            ]
        },
        {
            "name": "dynamodb-attribute-value-builder-v2-bytecode",
            "comment": "Exercised by the V2 caller of V2BytecodeOnV3Test and its generated linkage fixture.",
            "match": {
                "id": "api:software.amazon.awssdk.services.dynamodb.model.AttributeValue#builder()*"
            },
            "classification": "PRESERVED",
            "dimensions": [
                "source",
                "binary"
            ],
            "rationale": "The generated V3 AttributeValue union keeps the static builder() factory and its V2 JVM descriptor.",
            "evidenceIds": [
                "V2BytecodeOnV3Test"
            ]
        },
        {
            "name": "dynamodb-attribute-value-s-setter-v2-bytecode",
            "comment": "Exercised by the V2 caller of V2BytecodeOnV3Test and its generated linkage fixture.",
            "match": {
                "id": "api:software.amazon.awssdk.services.dynamodb.model.AttributeValue$Builder#s(Ljava/lang/String;)*"
            },
            "classification": "PRESERVED",
            "dimensions": [
                "source",
                "binary"
            ],
            "rationale": "The generated V3 AttributeValue.Builder keeps the string variant setter and its V2 JVM descriptor.",
            "evidenceIds": [
                "V2BytecodeOnV3Test"
            ]
        },
        {
            "name": "dynamodb-attribute-value-s-v2-bytecode",
            "comment": "Exercised by the V2 caller of V2BytecodeOnV3Test and its generated linkage fixture.",
            "match": {
                "id": "api:software.amazon.awssdk.services.dynamodb.model.AttributeValue#s()*"
            },
            "classification": "PRESERVED",
            "dimensions": [
                "source",
                "binary"
            ],
            "rationale": "The generated V3 AttributeValue keeps the string variant accessor and its V2 JVM descriptor.",
            "evidenceIds": [
                "V2BytecodeOnV3Test"
            ]
        },
        {
            "name": "dynamodb-attribute-value-n-v2-bytecode",
            "comment": "Exercised by the V2 caller of V2BytecodeOnV3Test and its generated linkage fixture.",
            "match": {
                "id": "api:software.amazon.awssdk.services.dynamodb.model.AttributeValue#n()*"
            },
            "classification": "PRESERVED",
            "dimensions": [
                "source",
                "binary"
            ],
            "rationale": "The generated V3 AttributeValue keeps the number variant accessor and its V2 JVM descriptor.",
            "evidenceIds": [
                "V2BytecodeOnV3Test"
            ]
        },
        {
            "name": "dynamodb-exception-v2-bytecode",
            "comment": "Exception hierarchy verified by the generated hierarchy and linkage fixtures.",
            "match": {
                "id": "api:software.amazon.awssdk.services.dynamodb.model.DynamoDbException"
            },
            "classification": "PRESERVED",
            "dimensions": [
                "source",
                "binary"
            ],
            "rationale": "The generated V3 service base exception keeps its name and the AwsServiceException -> SdkServiceException -> SdkException -> RuntimeException superclass chain.",
            "evidenceIds": [
                "ApiShapeCompatibilityTest"
            ]
        },
        {
            "name": "dynamodb-resource-not-found-exception-v2-bytecode",
            "comment": "Exception hierarchy verified by the generated hierarchy and linkage fixtures.",
            "match": {
                "id": "api:software.amazon.awssdk.services.dynamodb.model.ResourceNotFoundException"
            },
            "classification": "PRESERVED",
            "dimensions": [
                "source",
                "binary"
            ],
            "rationale": "The generated V3 modeled exception keeps its name and extends the binary-preserved DynamoDbException.",
            "evidenceIds": [
                "ApiShapeCompatibilityTest"
            ]
        },
        {
            "name": "dynamodb-service-client-configuration",
            "comment": "V3 clients expose resolved options through the shared SdkClientConfiguration; the service-specific configuration type is not generated.",
            "match": {
                "id": "api:software.amazon.awssdk.services.dynamodb.DynamoDbClient#serviceClientConfiguration()*"
            },
            "classification": "ADAPTED",
            "rationale": "The V3 client returns the resolved client configuration as SdkClientConfiguration.",
            "differences": [
                "Returns software.amazon.awssdk.core.client.config.SdkClientConfiguration instead of DynamoDbServiceClientConfiguration; DynamoDbServiceClientConfiguration is not generated."
            ],